data,hora,evento,local
4 de janeiro de 2016,15:30,"O Presidente da República agracia, com o grau de Comendador da Ordem do Infante D. Henrique, o Presidente do Comité Olímpico de Portugal e três atletas olímpicos medalhados",""
5 de janeiro de 2016,10:30,"O Presidente da República recebe, em audiência, o Presidente do Tribunal Constitucional",""
5 de janeiro de 2016,15:00,"Por ocasião do 30º aniversário da adesão de Portugal às Comunidades Europeias, o Presidente da República homenageia várias personalidades ligadas ao processo de integração europeia",""
5 de janeiro de 2016,18:45,"O Presidente da República recebe os cumprimentos dos Embaixadores de Portugal acreditados junto de vários Estados e organizações internacionais, por ocasião do Seminário Diplomático que decorre em Lisboa",""
6 de janeiro de 2016,10:30,"O Presidente da República recebe o Presidente, os Vice-Presidentes, os Líderes dos Grupos Parlamentares e os membros da Mesa da Assembleia da República, que lhe apresentaram cumprimentos de Ano Novo",""
6 de janeiro de 2016,18:00,"O Presidente da República  recebe o Rancho Filarmónico da Associação Portuguesa de Pais e Amigos do Cidadão Deficiente Mental, de Castelo Branco, o Grupo Coral Espranjar, de Fermentelos, Águeda, o Grupo de Cantares “As Nossas Raízes”, da Associação de Apoio aos Deficientes Visuais do Distrito de Braga, de Póvoa de Lanhoso, e o Grupo de Danças e Cantares do Centro Social Cultural e Recreativo de Montes da Senhora, de Proença-a-Nova, que cantarão “as Janeiras” no Palácio de Belém",""
7 de janeiro de 2016,11:30,"O Presidente da República recebe, em audiência, a Direção da Federação Nacional das Associações Juvenis",""
7 de janeiro de 2016,17:00,O Presidente da República recebe o Primeiro-Ministro para a reunião semanal,""
8 de janeiro de 2016,18:25,"O Presidente da República participa na Cerimónia Comemorativa do 30.º aniversário da adesão de Portugal às Comunidades Europeias, proferindo uma intervenção
","Mosteiro de Jerónimos, Lisboa"
11 de janeiro de 2016,11:30,"O Presidente da República recebe, em audiência, a Direção da Associação Portuguesa de Famílias Numerosas",""
11 de janeiro de 2016,15:30,"O Presidente da República  recebe, em audiência, a Direção do Centro de Estudos dos Povos e Culturas de Expressão Portuguesa",""
12 de janeiro de 2016,"",O Presidente da República recebe as cartas credenciais de novos Embaixadores em Portugal:,""
12 de janeiro de 2016,10:00,"Embaixadora da Ucrânia, Senhora Inna Ohnvets",""
12 de janeiro de 2016,10:25,"Embaixador da Tailândia, Krairawee Sirikul",""
12 de janeiro de 2016,10:50,"Embaixador da Sérvia, Oliver Antic",""
12 de janeiro de 2016,11:15,"Apresentação conjunta de credenciais por Embaixadores Não-Residentes:

- Embaixador do Djibouti, Ayeid Mousseid Yahya
- Embaixador de Fiji, Deo Saran
- Embaixador do Sri Lanka, Tilak Ranaviraja
- Embaixador da Zâmbia, Humphrey Chibanda",""
12 de janeiro de 2016,18:00,O Presidente da República confere posse aos novos membros do Conselho de Estado,""
13 de janeiro de 2016,11:25,"O Presidente da República recebe os cumprimentos de Ano Novo do Corpo Diplomático acreditado em Portugal, proferindo uma intervenção
",Palácio de Queluz
14 de janeiro de 2016,12:30,"O Presidente da República recebe os cumprimentos de Ano Novo dos Chefes dos Estados-Maiores das Forças Armadas, a quem oferece um almoço",""
14 de janeiro de 2016,17:00,O Presidente da República recebe o Primeiro-Ministro para a reunião semanal,""
18 de janeiro de 2016,15:00,"O Presidente da República inaugura as novas instalações do fabricante de equipamentos agrícolas e industriais TOMIX
","Local: Ramalhal, Torres Vedras"
19 de janeiro de 2016,11:30,O Presidente da República condecora com o Título de Membro Honorário da Ordem da Instrução Pública o Instituto Superior de Ciências Sociais e Políticas (ISCSP),""
19 de janeiro de 2016,15:00,"O Presidente da República visita o Hospital das Forças Armadas
","Azinhaga dos Ulmeiros, Paço do Lumiar, Lisboa"
20 de janeiro de 2016,11:30,"O Presidente da República recebe, em audiência, os órgãos diretivos da CASES - Cooperativa António Sérgio para a Economia Social",""
20 de janeiro de 2016,"","O Presidente da República recebe cumprimentos de Ano Novo do Presidente e dos Vice-Presidentes do Supremo Tribunal de Justiça, do Presidente e dos Juízes do Tribunal Constitucional, do Presidente e dos Vice-Presidentes do Supremo Tribunal Administrat",""
20 de janeiro de 2016,15:00,Presidente e Vice-Presidentes do Supremo Tribunal de Justiça,""
20 de janeiro de 2016,15:30,Presidente e Juízes do Tribunal Constitucional,""
20 de janeiro de 2016,16:00,Presidente e Vice-Presidentes do Supremo Tribunal Administrativo,""
20 de janeiro de 2016,16:30,Procuradora-Geral da República,""
22 de janeiro de 2016,17:00,O Presidente da República recebe o Primeiro-Ministro para a reunião semanal,""
24 de janeiro de 2016,13:00,O Presidente da República exerce o direito de voto nas Eleições Presidenciais,""
28 de janeiro de 2016,12:30,"O Presidente da República recebe o Presidente da República Eleito, Prof. Doutor Marcelo Rebelo de Sousa, a quem seguidamente oferecerá um almoço",""
29 de janeiro de 2016,17:00,O Presidente da República recebe o Primeiro-Ministro para a reunião semanal,""
1 de fevereiro de 2016,15:30,"O Presidente da República recebe, em audiência, a Secretária-Geral da Conferência Ibero-Americana, Rebeca Grynspan",""
2 de fevereiro de 2016,11:30,"O Presidente da República condecora, com a Grã-Cruz da Ordem da Liberdade, o Eng. António Guterres, antigo Alto Comissário das Nações Unidas para os Refugiados",""
3 de fevereiro de 2016,11:00,"O Presidente da República visita a Escola Prática de Polícia, da Polícia de Segurança Pública

- Guarda de Honra
- Visita às instalações
- Sessão Solene – Anfiteatro
  - Intervenção do Diretor Nacional da PSP, Superintendente-Chefe
    Luís Manuel Peça Farinha
  - Intervenção do Presidente da República
  - Cerimónia de imposição de condecoração
- Fotografia de grupo
- Almoço","Largo das Forças Armadas, Torres Novas
"
3 de fevereiro de 2016,"",Visita do Presidente da República ao Concelho de Rio Maior,""
3 de fevereiro de 2016,15:00,Visita às Salinas de Rio Maior,""
3 de fevereiro de 2016,15:35,"Visita à Nobre Alimentação, SA",""
3 de fevereiro de 2016,16:20,"Visita ao Complexo Desportivo de Rio Maior

- Intervenção da Presidente da Câmara Municipal de Rio Maior, Dra. Isaura Morais
- Intervenção do Presidente da República",""
4 de fevereiro de 2016,16:45,O Presidente da República recebe o Primeiro-Ministro para a reunião semanal,""
10 de fevereiro de 2016,17:00,O Presidente da República recebe o Primeiro-Ministro para a reunião semanal,""
11 de fevereiro de 2016,11:30,"O Presidente da República visita o Centro de Formação de Portalegre da Escola da Guarda, da Guarda Nacional Republicana

- Guarda de Honra
- Visita às instalações
- Sessão Solene – Igreja do Antigo Convento de S. Bernardo
  - Intervenção do Comandante-Geral da GNR, Tenente-General
    Manuel Mateus Costa da Silva Couto
  - Intervenção do Presidente da República
  - Cerimónia de imposição de condecoração
- Fotografia de grupo
- Almoço","Local: Avenida George Robinson, Portalegre
"
11 de fevereiro de 2016,14:45,O Presidente da República inaugura o Lar Residencial do Espírito Santo e a Estrutura Residencial para Pessoas Idosas Dr. Plínio Serrote da Santa Casa da Misericórdia de Portalegre,""
11 de fevereiro de 2016,16:30,Visita a Igreja de S. Francisco de Évora e Inauguração dos Núcleos Museológicos,""
12 de fevereiro de 2016,11:00,"O Presidente da República recebe, em audiência, o Presidente do Governo Regional da Madeira, Dr. Miguel Albuquerque",""
12 de fevereiro de 2016,16:00,"O Presidente da República condecora antigos membros de Governos com a Grã-Cruz da Ordem do Infante D. Henrique:

- Álvaro Miguel Rodrigues dos Santos Pereira
- António José de Castro Bagão Félix
- Luís Manuel Moreira de Campos e Cunha
- Maria de Lurdes Reis Rodrigues
- Nuno Paulo de Sousa Arrobas Crato
- Paulo José de Ribeiro Moita de Macedo
- Rui Carlos Pereira
- Vítor Louçã Rabaça Gaspar",""
16 de fevereiro de 2016,11:15,"O Presidente da República recebe, em audiência, o Chefe do Estado-Maior General das Forças Armadas, General Artur Pina Monteiro",""
16 de fevereiro de 2016,11:45,"O Presidente da República recebe, em audiência, o Prof. Doutor Adriano Moreira e o Dr. Nazim Ahmad, Representante em Portugal da Rede Aga Khan para o Desenvolvimento",""
16 de fevereiro de 2016,15:30,"O Presidente da República recebe, em audiência, os órgãos diretivos da Liga dos Bombeiros Portugueses",""
16 de fevereiro de 2016,17:30,"O Presidente da República visita a Sociedade Histórica da Independência de Portugal, proferindo uma intervenção",""
17 de fevereiro de 2016,11:30,"O Presidente da República preside à Cerimónia de Despedida que as Forças Armadas promovem no Instituto Universitário Militar

- Revista às Forças em Parada
- Homenagem aos Mortos em Combate
- Intervenção do Chefe do Estado-Maior General das Forças Armadas,
  General Artur Pina Monteiro
- Intervenção do Presidente da República
- Desfile das Forças em Parada",""
17 de fevereiro de 2016,17:00,O Presidente da República recebe o Primeiro-Ministro para a reunião semanal,""
18 de fevereiro de 2016,11:00,"O Presidente da República recebe, em audiência, o Representante da República para a Região Autónoma dos Açores, Embaixador Pedro Catarino",""
18 de fevereiro de 2016,11:30,"O Presidente da República recebe, em audiência, a Direção do Instituto para a Promoção e Desenvolvimento da América Latina (IPDAL)",""
18 de fevereiro de 2016,15:30,"O Presidente da República condecora um grupo de personalidades da Academia e da Cultura, bem como a Casa do Artista.

Serão agraciados (com indicação do grau e da Ordem):

- Prof. Doutor Michel Renaud, Professor Catedrático e Membro do Conselho Nacional de Ética para as Ciências da Vida – Comendador da Ordem de Sant’Iago da Espada 
- Prof. Doutor Alberto Duarte Carvalho, Professor Catedrático – Grande-Oficial da Ordem do Infante D. Henrique 
- Prof. Doutor António Costa de Albuquerque de Sousa Lara, Professor Catedrático – Grande-Oficial da Ordem do Infante D. Henrique 
- Prof. Doutor Miguel Telles Antunes, Professor Catedrático e Paleontologista – Grande-Oficial da Ordem do Infante D. Henrique 
- Jorge Fernando da Silva Nunes, Músico e Compositor – Comendador da Ordem do Infante D. Henrique 
- Dr. Nuno de Assis Simões da Costa Rogeiro, Docente Universitário, Jornalista e Comentador – Comendador da Ordem do Infante D. Henrique
- Dr. José Luiz Carvalho Cardoso, Fundador da AESE Business School (Associação de Estudos Superiores de Empresa) – Comendador da Ordem da Instrução Pública
- Casa do Artista (Associação de Apoio aos Artistas, IPSS) – Membro Honorário da Ordem do Mérito",""
18 de fevereiro de 2016,17:00,"O Presidente da República recebe, em audiência, o Primeiro-Ministro de Cabo Verde, Dr. José Maria Neves",""
19 de fevereiro de 2016,12:00,"O Presidente da República recebe, em audiência, o Chefe do Estado-Maior da Força Aérea, General José Araújo Pinheiro",""
24 de fevereiro de 2016,12:00,"O Presidente da República confere posse ao Chefe do Estado-Maior da Força Aérea, Tenente-General Piloto-Aviador Manuel Teixeira Rolo",""
24 de fevereiro de 2016,15:00,O Presidente da República visita a sede da Associação dos Deficientes das Forças Armadas,""
24 de fevereiro de 2016,17:00,"O Presidente da República recebe, em audiência, a direção da Associação Empresários pela Inclusão Social (EPIS)",""
25 de fevereiro de 2016,12:30,"O Presidente da República recebe, em audiência, o Presidente da Assembleia Legislativa Regional da Madeira, Dr. José Tranquada Gomes",""
25 de fevereiro de 2016,15:00,"O Presidente da República condecora, com a Grã-Cruz da Ordem do Infante D. Henrique, o Representante da República para a Região Autónoma da Madeira, Conselheiro Ireneu Cabral Barreto",""
25 de fevereiro de 2016,17:00,O Presidente da República recebe o Primeiro-Ministro para a reunião semanal,""
26 de fevereiro de 2016,12:00,"O Presidente da República condecora, com vários graus das Ordens Honoríficas, um grupo de gestores e empresários.

Serão agraciadas as seguintes personalidades:

- António Manuel Frade Saraiva
- Prof. Doutor João Bento
- Eng. João Manuel Resende Picoito
- Dr. António Raposo de Lima
- Adelino Silva Martins
- José Ricardo Lopes Abrantes
- Dr. Alberto Manuel Coutinho Henriques",""
29 de fevereiro de 2016,11:00,"O Presidente da República condecora o antigo Chefe do Estado-Maior da Força Aérea, General José Araújo Pinheiro, e o Presidente da Direção Central da Liga dos Combatentes, Tenente-General Joaquim Chito Rodrigues",""
2 de março de 2016,"",O Presidente da República recebe as cartas credenciais de novos Embaixadores em Portugal:,""
2 de março de 2016,10:00,"Embaixador da Geórgia, Revaz Beshidze",""
2 de março de 2016,10:25,"Embaixadora do Paquistão, Senhora Zehra H. Akbari",""
2 de março de 2016,10:50,"Embaixador da Moldova, Dumitru Socolan",""
2 de março de 2016,11:15,"Embaixadora do Peru, Senhora Glória Lissette Nalvarte Simoni de Isasi",""
2 de março de 2016,18:00,"O Presidente da República agracia, com graus da Ordem do Infante D. Henrique, o Chefe e o Subchefe do Protocolo do Estado, respetivamente Embaixador António Almeida Lima e Dr. Jorge Silva Lopes",""
3 de março de 2016,11:00,"O Presidente da República preside à reunião do Conselho de Ministros dedicada ao Mar, a convite do Primeiro-Ministro
","Forte de S. Julião da Barra, Avenida Marginal, Oeiras"
4 de março de 2016,11:30,"O Presidente da República recebe, em audiência, a Ministra dos Negócios Estrangeiros da Colômbia, María Ángela Holguín",""
7 de março de 2016,11:30,"O Presidente da República desloca-se à Câmara Municipal de Cascais para presidir a uma sessão solene durante a qual lhe será atribuída a Chave da Vila e o título de Cidadão Honorário do Município.

O Presidente da República proferirá uma intervenção",""
9 de março de 2016,09:30,"O Presidente da República recebe Honras Militares, a cargo do Esquadrão Presidencial da Guarda Nacional Republicana, antes de deixar o Palácio de Belém a caminho da Assembleia da República, a fim de participar na cerimónia de Tomada de Posse do Presidente Marcelo Rebelo de Sousa.

","Palácio de Belém, Pátio dos Bichos"
9 de março de 2016,09:45,"Chegada do Presidente da República ao Palácio de S. Bento

- Honras Militares

Sessão Solene de Tomada de Posse do Presidente da República Marcelo Rebelo de Sousa",""
