data,hora,evento,local
2 de abril de 2018,16:00,"Inauguração da exposição “Mais Alto e Mais Longe - Por uma Causa”, com fotografias das expedições de Ângelo Felgueiras, a favor da Acreditar - Associação de Pais e Amigos de Crianças com Cancro
","Praça central do Centro Comercial Colombo, Lisboa"
3 de abril de 2018,"",Apresentação de cartas credenciais de novos Embaixadores em Portugal:,""
3 de abril de 2018,15:00,"Embaixador de Israel, Raphael Gamzou",""
3 de abril de 2018,15:25,"Embaixador de Moçambique, Joaquim Casimiro Simeão Bule",""
3 de abril de 2018,15:50,"Embaixador de Itália, Uberto Vanni d’Archirafi",""
3 de abril de 2018,16:15,"Apresentação conjunta de cartas credenciais pelos Embaixadores Não-Residentes:

- Embaixador da Tanzânia, Samuel William Shelukindo
- Embaixadora do Brunei, Datin Paduka Haji Yussof
- Embaixadora do Burundi, Christine Nina Niyonsavye
- Embaixador da Letónia, Janis Silis",""
4 de abril de 2018,12:00,"Visita ao Estabelecimento Prisional de Santa Cruz do Bispo - Feminino
","Santa Cruz do Bispo, Matosinhos"
5 de abril de 2018,17:45,"Sessão de encerramento da Conferência Internacional “Higher Education in Emergencies” (Educação Superior em Situações de Emergência)
","Fundação Calouste Gulbenkian, Lisboa"
5 de abril de 2018,19:00,"Cerimónia de Agraciamento do Antigo Presidente do Parlamento Europeu, Martin Schulz",""
7 de abril de 2018,12:00,"Visita à exposição fotográfica “Mulheres Ciganas” seguido de almoço com Comunidade Cigana, por ocasião do Dia Internacional dos Ciganos que se celebra a 8 de abril
",Câmara Municipal da Maia 
8 de abril de 2018,"","Visita a França por ocasião das Comemorações do Centenário da Batalha de La Lys
 
8 e 9 de abril de 2018",""
8 de abril de 2018,17:00,Descerramento de placa comemorativa do Centenário da Batalha de La Lys na Avenue des Portugais em Paris,""
8 de abril de 2018,18:30,Cerimónia Militar de Homenagem ao Soldado Desconhecido Francês no Arco do Triunfo em Paris,""
9 de abril de 2018,"","Visita a França por ocasião das Comemorações do Centenário da Batalha de La Lys
 
8 e 9 de abril de 2018",""
9 de abril de 2018,08:00,"Pequeno-almoço de trabalho com o Presidente da República Francesa, Emmanuel Macron, no Palácio do Eliseu em Paris",""
9 de abril de 2018,10:30,"Cerimónia Militar de Homenagem aos Portugueses que perderam a vida na Primeira Guerra Mundial no Cemitério Militar Português de Richebourg, com a presença do Presidente da República Francesa, Emmanuel Macron",""
9 de abril de 2018,12:00,"Visita à exposição “Racines” (Raízes) de Aurore Rouffelaers junto no Pavilhão Desportivo de Richebourg

- Imposição da Medalha da Defesa Nacional, 4ª Classe, a três cidadãos residentes em França e dirigentes da Liga dos Combatentes: Felícia Pailleux, Afonso Maia (a título póstumo) e João Marques
- Almoço no Pavilhão Desportivo de Richebourg",""
9 de abril de 2018,14:00,Visita à igreja de La Couture,""
9 de abril de 2018,14:15,Cerimónia Militar de Homenagem no Monumento aos Portugueses mortos na Grande Guerra em La Couture,""
11 de abril de 2018,10:30,"Sessão de Abertura do Congresso 2018 da CIP - Confederação Empresarial de Portugal, sob o tema “O Valor das Empresas”
","Europarque, Santa Maria da Feira"
11 de abril de 2018,"","Visita de Estado à República Árabe do Egito
 
11 a 13 de abril de 2018",""
11 de abril de 2018,20:00,"Chegada do Presidente da República ao Aeroporto Internacional do Cairo, Egito",""
12 de abril de 2018,"","Visita de Estado à República Árabe do Egito
 
11 a 13 de abril de 2018",""
12 de abril de 2018,11:00,"Cerimónia oficial de boas-vindas no Palácio Presidencial de Heliópolis
- Honras militares: execução dos hinos nacionais e revista à guarda de honra
- Apresentação das delegações
- Fotografia oficial",""
12 de abril de 2018,11:20,"Encontro a sós entre o Presidente da República Árabe do Egito, Abdel Fattah El-Sisi, e o Presidente da República",""
12 de abril de 2018,11:40,Encontro entre o Presidente da República Árabe do Egito e o Presidente da República alargado às respetivas comitivas,""
12 de abril de 2018,12:05,"Cerimónia de assinatura de Memorandos de entendimento no Salão principal do Palácio Presidencial de Heliópolis
- Memorando de entendimento entre o Camões - Instituto da Cooperação e da Língua, a Universidade do Porto e a Universidade de Ain Shams
- Memorando de entendimento sobre a cooperação entre a Zona Económica do Canal do Suez e a AICEP Global Parques",""
12 de abril de 2018,12:30,Declarações dos dois Chefes de Estado à imprensa,""
12 de abril de 2018,13:15,Almoço oficial oferecido pelo Presidente da República Árabe do Egito em honra do Presidente da República,""
12 de abril de 2018,14:30,"Encontro com o Grande Imã da Mesquita de al-Azhar, Sheikh Ahmed Mohamed el-Tayeb",""
12 de abril de 2018,15:00,Visita à Mesquita de al-Azhar,""
12 de abril de 2018,15:30,"Conferência na Universidade de al-Azhar
- Intervenção do Presidente da República, seguido de debate",""
12 de abril de 2018,17:15,"Encontro entre o Presidente do Parlamento, Ali Abdel Aal, o Presidente da República e respetivas comitivas no Parlamento",""
12 de abril de 2018,18:05,"Encontro entre o Primeiro-ministro, Sherif Ismail, o Presidente da República e respetivas comitivas na Sede do Conselho de Ministros",""
12 de abril de 2018,18:35,Sessão de encerramento do Fórum Económico Portugal-Egito,""
12 de abril de 2018,19:30,Encontro com a Comunidade Portuguesa,""
13 de abril de 2018,"","Visita de Estado à República Árabe do Egito
 
11 a 13 de abril de 2018",""
13 de abril de 2018,10:00,Visita às pirâmides de Gizé (Keops) e Visita ao Museu Egípcio,""
13 de abril de 2018,12:30,"Encontro a sós de Sua Santidade Tawadros II, Papa de Alexandria e Patriarca da Sede de São Marcos, com o Presidente da República no Patriarcado Copto-Ortodoxo",""
13 de abril de 2018,12:50,Encontro entre o Papa de Alexandria e Patriarca da Sede de São Marcos e o Presidente da República alargado às respetivas comitivas,""
13 de abril de 2018,13:05,"Visita à Igreja Ortodoxa Copta de São Pedro
- Homenagem, no memorial, às vítimas do atentado de dezembro de 2016",""
14 de abril de 2018,11:30,"Cerimónias de Comemoração do Dia do Combatente, do centenário da Batalha de La Lys e 82.ª romagem ao Túmulo do Soldado Desconhecido
","Mosteiro de Santa Maria da Vitória, Batalha"
1 de março de 2018,"","Visita Oficial a Portugal do Presidente da República Federal da Alemanha, Frank-Walter Steinmeier",""
1 de março de 2018,11:00,"Cerimónia de boas-vindas ao Presidente da República Federal da Alemanha

Honras Militares no Pátio dos Bichos:
 - Hinos Nacionais
 - Ponto de Continência
 - Saudação ao Estandarte Nacional

- Fotografia oficial e assinatura do livro de honra

- Encontro do Presidente da República com o Presidente da República Federal da Alemanha

- Encontro dos dois Chefes de Estado alargado às delegações","Palácio de Belém
"
1 de março de 2018,12:20,Declarações dos dois Chefes de Estado à imprensa,""
1 de março de 2018,15:20,Passeio de elétrico da Basílica da Estrela até à Praça da Figueira passando por alguns dos bairros mais antigos de Lisboa,""
1 de março de 2018,17:00,"Cerimónia de Tomada de Posse do Chefe do Estado-Maior-General das Forças Armadas, Almirante António Manuel Fernandes da Silva Ribeiro",""
1 de março de 2018,18:00,"Cerimónia de Tomada de Posse do Chefe do Estado-Maior da Armada, Almirante António Maria Mendes Calado",""
1 de março de 2018,"","Visita Oficial a Portugal do Presidente da República Federal da Alemanha, Frank-Walter Steinmeier",""
1 de março de 2018,20:00,"Jantar oficial oferecido pelo Presidente da República em honra do Presidente da República Federal da Alemanha
",Palácio Nacional da Ajuda
2 de março de 2018,"","Visita Oficial a Portugal do Presidente da República Federal da Alemanha, Frank-Walter Steinmeier",""
2 de março de 2018,11:40,"Inauguração da exposição “Encontros” de Günter Grass
","Casa-Museu Guerra Junqueiro, Porto"
2 de março de 2018,12:40,"Cerimónia de Entronização da Confraria do Vinho do Porto
","Palácio da Bolsa, Porto"
2 de março de 2018,13:15,"Almoço oferecido pelo Presidente da Câmara Municipal do Porto, Rui Moreira, e presidido pelo Presidente da República, em honra do Presidente da República Federal da Alemanha
","Palácio da Bolsa, Porto"
2 de março de 2018,14:30,"Visita à Igreja de S. Francisco e passeio a pé pela Ribeira
",Porto
3 de março de 2018,11:20,"Cerimónia na Igreja Adventista do Sétimo Dia
",Lisboa 
5 de março de 2018,11:30,"Visita à Base Aérea N.º 11
",Beja
5 de março de 2018,19:30,"Cerimónia de entrega do Prémio Pessoa 2017 ao arquiteto Manuel Aires Mateus
","Grande Auditório da Culturgest, Lisboa"
6 de março de 2018,19:00,"Cerimónia de homenagem ao pintor Cruzeiro Seixas
",Centro Português de Serigrafia
7 de março de 2018,12:00,"Visita ao Museu Arqueológico de São Miguel de Odrinhas e inauguração da exposição “Agricultores e Pastores da Pré-História - Testemunhos da Região de Sintra”
",São Miguel de Odrinhas - Sintra
8 de março de 2018,11:00,"Visita à fábrica Diniz & Cruz
",Alfragide - Amadora 
9 de março de 2018,12:00,"Lançamento do Livro “Dois anos depois: Júbilo e Tragédia”
",Palácio de Belém 
9 de março de 2018,16:00,"Aula-debate com alunos do Ensino Secundário
","Escola Básica e Secundária Professor Ruy Luís Gomes, Laranjeiro - Almada"
12 de março de 2018,"","Visita de Estado do Presidente da República à República Helénica
 
12 a 14 de março de 2018",""
12 de março de 2018,18:00,Chegada do Presidente da República ao Aeroporto Internacional Eleftherios Venizelos em Atenas,""
12 de março de 2018,19:00,"Receção em honra da comunidade portuguesa oferecida pelo Presidente da República
",Hotel Grande Bretagne
13 de março de 2018,"","Visita de Estado do Presidente da República à República Helénica
 
12 a 14 de março de 2018",""
13 de março de 2018,11:00,"Cerimónia de deposição de uma coroa de flores no Monumento ao Soldado Desconhecido
",Praça Syntagma
13 de março de 2018,11:15,"Cerimónia oficial de boas-vindas no Palácio Presidencial
- Honras militares: Saudação às bandeiras, hinos e revista à guarda de honra
- Apresentação das delegações",""
13 de março de 2018,11:30,"Encontro a sós entre o Presidente da República Helénica, Prokopios Pavlopoulos, e o Presidente da República
",Gabinete do Presidente da República
13 de março de 2018,11:45,Encontro entre o Presidente da República Helénica e o Presidente da República alargado às respetivas comitivas,""
13 de março de 2018,13:00,"Encontro entre o Primeiro-ministro da República Helénica, Alexis Tsipras, e o Presidente da República
",Maximos Mansion
13 de março de 2018,13:40,"Encontro entre o Presidente do Parlamento da República Helénica, Nikos Voutsis, e o Presidente da República
",Parlamento Helénico
13 de março de 2018,14:20,Almoço oferecido pelo Presidente da República Helénica em honra do Presidente da República,""
13 de março de 2018,17:00,"Cerimónia de Doutoramento “Honoris Causa” pela Universidade de Atenas com a presença do Presidente da República Helénica
",Universidade de Atenas
13 de março de 2018,20:30,"Jantar oficial oferecido pelo Presidente da República Helénica em honra do Presidente da República
",Palácio Presidencial
14 de março de 2018,"","Visita de Estado do Presidente da República à República Helénica
 
12 a 14 de março de 2018",""
14 de março de 2018,11:00,Visita ao campo de refugiados da Organização Internacional para as Migrações em Tebas (IOM Thiva Open Accommodation Center),""
14 de março de 2018,13:30,"Almoço na Residência oficial do Embaixador de Portugal em Atenas com um conjunto de personalidades da sociedade civil grega com ligações a Portugal, oriundas do mundo académico e cultural",""
14 de março de 2018,15:20,Visita ao JRS (Jesuit Refugee Service/Serviço Jesuíta aos Refugiados) de apoio social a refugiados e encontro com voluntários portugueses,""
14 de março de 2018,16:30,"Debate aberto sobre “As raízes e o futuro da Europa” promovido pela EPLO (European Public Law Organization) com a presença do Presidente da República Helénica
",Palácio Presidencial
15 de março de 2018,14:00,"Audiência ao Grande Imã da Mesquita de al-Azhar, Sheikh Ahmed Mohamed el-Tayeb",""
15 de março de 2018,18:00,"Inauguração da Exposição “Um Museu do Outro Mundo” com obras de José de Guimarães
","Museu do Oriente, Lisboa "
16 de março de 2018,14:30,Audiência à Nova Direção Política do CDS - Partido Popular (CDS-PP) ,""
16 de março de 2018,16:00,"Encontros de Reflexão Comemorativos dos 50 anos da Fundação da Comunidade Islâmica de Lisboa “CIL” (1968-2018) 
",Mesquita Central de Lisboa
19 de março de 2018,20:00,"Gala Quinas de Ouro
","Pavilhão Carlos Lopes, Lisboa"
20 de março de 2018,10:30,"Sessão de Abertura da 1ª Cimeira das Áreas Metropolitanas de Lisboa e Porto
 ","Sala da Música Palácio Nacional de Queluz
"
20 de março de 2018,22:00,"Gala da Sociedade Portuguesa de Autores
",Centro Cultural de Belém 
21 de março de 2018,15:00,"Reunião do Conselho Superior de Defesa Nacional
",Palácio de Belém
21 de março de 2018,19:00,"Sessão de Encerramento do debate sobre a Estratégia Nacional de Combate à Pobreza e Exclusão Social
",Fundação Calouste Gulbenkian
24 de março de 2018,"",Ação de Limpeza Florestal: Trabalhos de gestão de combustível e conservação de habitats naturais,""
24 de março de 2018,11:30,Parque Nacional Peneda-Gerês - Portela do Homem,""
24 de março de 2018,15:00,Regimento de Infantaria N.º 14 - Viseu,""
1 de fevereiro de 2018,14:00,"Visita a utentes dos projetos de “Housing First” da AEIPS - Associação para o Estudo e Integração Psicossocial e da Associação Crescer
",Lisboa
2 de fevereiro de 2018,15:00,Audiência a João Semedo e José Manuel Pureza Organizadores da Conferência Nacional “Despenalizar a morte assistida: tolerância e livre decisão”,""
2 de fevereiro de 2018,"",Audiências aos Parceiros Sociais,""
2 de fevereiro de 2018,16:00,Confederação do Comércio e Serviços de Portugal (CCP),""
2 de fevereiro de 2018,17:00,Confederação Empresarial de Portugal (CIP),""
5 de fevereiro de 2018,"",Audiências aos Parceiros Sociais,""
5 de fevereiro de 2018,16:00,União Geral de Trabalhadores (UGT),""
5 de fevereiro de 2018,17:00,Confederação Geral dos Trabalhadores Portugueses - Intersindical Nacional (CGTP-IN),""
5 de fevereiro de 2018,18:00,"Reunião de Trabalho - Estratégia Nacional para a Integração de Pessoas em Situação de Sem-Abrigo (ENIPSSA)
",Palácio de Belém
6 de fevereiro de 2018,11:00,Programa “Escritores no Palácio de Belém” com Isabel Alçada e Ana Maria Magalhães,""
6 de fevereiro de 2018,14:30,Programa “Escritores no Palácio de Belém” com António Lobo Antunes,""
6 de fevereiro de 2018,15:20,"Sessão de Abertura da “Banking Summit - Leading into a New Era” promovida pela Associação Portuguesa de Bancos e pela SIBS
","SUD Lisboa - Av. Brasília, Lisboa"
7 de fevereiro de 2018,11:40,"XII Encontro COTEC Europa sob o tema “WORK 4.0: Rethinking the Human-Technology Alliance”
",Palácio Nacional de Mafra
11 de fevereiro de 2018,15:00,"Receção à Seleção Nacional de Futsal que se sagrou campeã europeia da modalidade em Liubliana, Eslovénia",""
12 de fevereiro de 2018,11:30,"Visita ao SISAB 2018 - 23.º Salão Internacional do Setor Alimentar e Bebidas
","Altice Arena, Lisboa"
12 de fevereiro de 2018,15:00,Audiência a uma delegação da ANMP - Associação Nacional de Municípios Portugueses,""
12 de fevereiro de 2018,15:30,Audiência a uma delegação da Ordem dos Psicólogos Portugueses,""
14 de fevereiro de 2018,"",Audiências aos Partidos Políticos com representação parlamentar:,""
14 de fevereiro de 2018,12:00,Pessoas-Animais-Natureza (PAN),""
14 de fevereiro de 2018,13:00,Partido Ecologista “Os Verdes” (PEV),""
15 de fevereiro de 2018,"",Audiências aos Partidos Políticos com representação parlamentar:,""
15 de fevereiro de 2018,12:00, Partido Comunista Português (PCP),""
15 de fevereiro de 2018,14:00,"Visita à Acreditar - Associação de Pais e Amigos de Crianças com Cancro por ocasião do Dia Mundial da Criança com Cancro
",Lisboa
15 de fevereiro de 2018,"",Audiências aos Partidos Políticos com representação parlamentar:,""
15 de fevereiro de 2018,19:00, CDS - Partido Popular (CDS-PP),""
16 de fevereiro de 2018,12:00,"Encerramento das Comemorações dos 60 anos do Instituto Português do Sangue e da Transplantação (IPST)
","Salão Nobre da Academia de Ciências de Lisboa, Lisboa"
16 de fevereiro de 2018,15:00,"Visita ao Laboratório Militar de Produtos Químicos e Farmacêuticos (LMPQF) por ocasião das comemorações do centenário da instituição
",Lisboa
16 de fevereiro de 2018,"",Audiências aos Partidos Políticos com representação parlamentar:,""
16 de fevereiro de 2018,17:00,Bloco de Esquerda (B.E.),""
16 de fevereiro de 2018,18:00,Partido Socialista (PS),""
17 de fevereiro de 2018,18:00,Audiência a uma delegação da AVMISP - Associação das Vítimas do Maior Incêndio de Sempre em Portugal,""
19 de fevereiro de 2018,10:30,"Cerimónia de atribuição do título de Doutor “Honoris Causa” ao Secretário-geral das Nações Unidas, António Guterres
","Aula Magna da Reitoria da Universidade de Lisboa, Lisboa"
19 de fevereiro de 2018,14:30,Audiência à Nova Direção Política do Partido Social Democrata (PPD/PSD),""
20 de fevereiro de 2018,"","Visita de Estado do Presidente da República à República Democrática de São Tomé e Príncipe
 
20 a 22 de fevereiro de 2018",""
20 de fevereiro de 2018,10:00,"Cerimónia Oficial de Boas-vindas no Palácio do Povo
- Honras militares
- Fotografia oficial
- Apresentação das comitivas",""
20 de fevereiro de 2018,10:25,"Encontro a sós entre o Presidente da República e o Presidente da República Democrática de São Tomé e Príncipe, Evaristo do Espirito Santo Carvalho, no Gabinete do Presidente",""
20 de fevereiro de 2018,10:40,Encontro dos dois Chefes de Estado alargado às delegações,""
20 de fevereiro de 2018,10:55,Declarações dos dois Chefes de Estado à Imprensa,""
20 de fevereiro de 2018,11:15,"Encontro entre o Presidente da República e o Presidente da Assembleia Nacional, José da Graça Diogo, com lideres das bancadas parlamentares na Assembleia Nacional",""
20 de fevereiro de 2018,12:00,"Encontro entre o Presidente da República e o Primeiro-Ministro e Chefe de Governo de São Tomé e Príncipe, Patrice Trovoada, no Palácio do Governo",""
20 de fevereiro de 2018,12:25,Saudações do Presidente da República e do Primeiro-Ministro de São Tomé e Príncipe a Grupos Culturais e Populares na Praça Yon Gato,""
20 de fevereiro de 2018,13:00,Almoço com ONG's na Chancelaria da Embaixada de Portugal em São Tomé e Príncipe,""
20 de fevereiro de 2018,14:30,Sessão de abertura do Fórum económico luso-santomense no Centro Cultural Português,""
20 de fevereiro de 2018,15:30,Visita ao Navio NRP Zaire no Porto de Ana Chaves,""
20 de fevereiro de 2018,16:15,"Encontro com cooperantes portugueses nas áreas da Saúde, Educação e Formação Profissional na Chancelaria da Embaixada de Portugal em São Tomé e Príncipe",""
20 de fevereiro de 2018,19:30,Jantar oficial oferecido pelo Presidente da República Democrática de São Tomé e Príncipe em honra do Presidente da República,""
21 de fevereiro de 2018,"","Visita de Estado do Presidente da República à República Democrática de São Tomé e Príncipe
 
20 a 22 de fevereiro de 2018",""
21 de fevereiro de 2018,09:45,Inauguração e visita à Escola Portuguesa de São Tomé e Príncipe,""
21 de fevereiro de 2018,11:00,Encontro com Estudantes na Universidade de São Tomé e Príncipe,""
21 de fevereiro de 2018,12:20,"Almoço oferecido pelo Primeiro-Ministro e Chefe de Governo de São Tomé e Príncipe, Patrice Trovoada, em honra do Presidente da República na Cacau",""
21 de fevereiro de 2018,14:30,"Cerimónia de deposição de uma coroa de flores no Monumento dos Mártires da Liberdade
- Declarações à Imprensa",""
21 de fevereiro de 2018,15:30,Visita à Obra das Irmãs Franciscanas e inauguração do Centro Polidesportivo,""
21 de fevereiro de 2018,19:00,Encontro com a Comunidade Portuguesa de São Tomé e Príncipe na Chancelaria da Embaixada de Portugal,""
22 de fevereiro de 2018,"","Visita de Estado do Presidente da República à República Democrática de São Tomé e Príncipe
 
20 a 22 de fevereiro de 2018",""
22 de fevereiro de 2018,10:00,"Chegada do Presidente da República ao Aeroporto da Região Autónoma do Príncipe
- Alas Militares",""
22 de fevereiro de 2018,10:30,Cerimónia de Boas-vindas no Palácio do Governador Regional,""
22 de fevereiro de 2018,11:00,Visita ao Polo Cultural Português,""
22 de fevereiro de 2018,11:30,Visita à Escola Secundária Padrão,""
22 de fevereiro de 2018,12:30,Apresentação sobre a biodiversidade e as plantas medicinais endémicas no Parque da Biodiversidade,""
22 de fevereiro de 2018,13:15,"Visita à Roça Sundy
- Declarações à Imprensa
- Visita ao local da experiência científica sobre a teoria da relatividade
- Almoço oferecido pelo Governo Regional",""
22 de fevereiro de 2018,15:45,Encontro do Presidente da República com o Governo Regional na Residência Oficial,""
26 de fevereiro de 2018,13:15,"Almoço com o Presidente do Partido Social Democrata, Rui Rio
",Palácio de Belém
26 de fevereiro de 2018,16:00,"Homenagem a Rómulo de Carvalho
",Lisboa
26 de fevereiro de 2018,18:00,"Sessão de Apresentação do livro “Europa de A a Z: Dicionário de Termos Europeus”
",Salão Nobre da Reitoria da Universidade de Lisboa 
27 de fevereiro de 2018,"",Audiências aos Partidos Políticos com representação parlamentar:,""
27 de fevereiro de 2018,15:00,Pessoas-Animais-Natureza (PAN),""
27 de fevereiro de 2018,18:15,"Sessão de Encerramento do 1.º Encontro Nacional dos NPISA - Núcleos de Planeamento e Intervenção Sem-Abrigo
","Auditório da Culturgest, Lisboa "
28 de fevereiro de 2018,12:30,"Cerimónia de Agraciamento do Chefe do Estado-Maior-General das Forças Armadas (CEMGFA), General Artur Pina Monteiro",""
28 de fevereiro de 2018,18:00,"Sessão de Encerramento da Conferência “A Solução Ferroviária”
","Sede Nacional da Ordem dos Engenheiros, Lisboa"
3 de janeiro de 2018,18:30,"Presidente da República recebe cumprimentos de Ano Novo dos Chefes de Missão, Embaixadores e Cônsules-gerais de Portugal acreditados junto de vários Estados e Organizações Internacionais, por ocasião do Seminário Diplomático que decorre em Lisboa
",Antigo Museu Nacional dos Coches
6 de janeiro de 2018,15:00,"Presidente da República recebe o Grupo de Cantares “Terras de Tomás Ribeiro” de Parada de Gonta, Tondela, um dos concelhos atingidos pelos incêndios de outubro, que vem cantar “as Janeiras”",""
7 de janeiro de 2018,16:00,"Tributo a Mário Soares
","Cemitério dos Prazeres, Lisboa"
12 de janeiro de 2018,14:00,Entrega do Pacto para a Justiça ao Presidente da República pelas instituições subscritoras,""
12 de janeiro de 2018,14:15,Audiência à Associação Sindical de Juízes Portugueses,""
12 de janeiro de 2018,15:00,Audiência ao Sindicato dos Magistrados do Ministério Público,""
12 de janeiro de 2018,16:00,Audiência ao Sindicato dos Funcionários Judiciais,""
12 de janeiro de 2018,17:00,Audiência ao Sindicato dos Oficiais de Justiça,""
15 de janeiro de 2018,17:00,Audiência ao Presidente e Juízes do Tribunal Constitucional,""
15 de janeiro de 2018,18:00,"Audiência à Provedora de Justiça, Maria Lúcia Amaral",""
15 de janeiro de 2018,19:00,Audiência a uma delegação da Ordem dos Advogados,""
17 de janeiro de 2018,17:00,"Audiência ao Presidente do Supremo Tribunal de Justiça, António Henriques Gaspar",""
17 de janeiro de 2018,18:00,"Audiência à Procuradora-Geral da República, Joana Marques Vidal",""
18 de janeiro de 2018,15:00,"Sessão Solene de Abertura do Ano Judicial
","Supremo Tribunal de Justiça, Lisboa"
19 de janeiro de 2018,14:45,"Cerimónia de Tomada de Posse da Provedora de Justiça, Professora Doutora Maria Lúcia Amaral, como Membro do Conselho de Estado",""
19 de janeiro de 2018,15:00,Reunião do Conselho de Estado,""
20 de janeiro de 2018,18:00,"Sessão de Encerramento do 3.º Congresso da Plataforma para o Crescimento Sustentável - “Portugal no Futuro: desafios, reformas e compromissos”
","ISCSP - Instituto Superior de Ciências Sociais e Políticas, Lisboa"
23 de janeiro de 2018,15:00,"Cerimónia de abertura Cascais 2018 - Capital Europeia da Juventude
","Centro de Congressos do Estoril, Cascais"
23 de janeiro de 2018,17:30,"Sessão Solene na Academia de Marinha
","Instalações Centrais de Marinha, Lisboa"
24 de janeiro de 2018,11:30,"Aula-debate com alunos do Ensino Secundário
","Escola Secundária de Camarate, Loures"
24 de janeiro de 2018,"",Apresentação de cartas credenciais de novos Embaixadores em Portugal:,""
24 de janeiro de 2018,14:00,"Embaixador da Áustria, Robert Zischg",""
24 de janeiro de 2018,14:25,"Embaixador da República Checa, Petr Selepa",""
24 de janeiro de 2018,14:50,"Embaixadora do Paraguai, Maria José Argaña Mateu",""
24 de janeiro de 2018,15:15,"Embaixador da República Eslovaca, Oldřich Hlaváček",""
24 de janeiro de 2018,15:45,"Apresentação conjunta de cartas credenciais pelos Embaixadores Não-Residentes:

 - Embaixador da Lituânia, Renatas Norkus
 - Embaixadora da Nova Zelândia, Jane Coombs
 - Embaixador do Vietname, Nguyen Thiep",""
