data,hora,evento,local
24 de janeiro de 2018,17:30,"Visita a feridos do incêndio na Associação Cultural, Recreativa e Humanitária de Vila Nova da Rainha, Tondela, que se encontram internados no Hospital Dona Estefânia e no Hospital de Santa Maria
","Hospital Dona Estefânia, Lisboa"
25 de janeiro de 2018,16:00,"Apresentação de cumprimentos de Ano Novo pelo Corpo Diplomático acreditado em Portugal
",Palácio Nacional de Queluz
26 de janeiro de 2018,14:00,"Audiência ao Secretário-Geral da NATO, Jens Stoltenberg",""
26 de janeiro de 2018,17:00,"Sessão Solene de Abertura do XVI Congresso Nacional da ANAFRE - Associação Nacional de Freguesias
","Viseu Arena, Viseu"
29 de janeiro de 2018,15:00,Audiência a uma delegação da Ordem dos Notários,""
30 de janeiro de 2018,14:30,Programa “Escritores no Palácio de Belém” com Ricardo Araújo Pereira,""
30 de janeiro de 2018,16:00,"Audiência ao Presidente do Supremo Tribunal Administrativo, Vítor Manuel Gonçalves Gomes",""
30 de janeiro de 2018,17:00,"Audiência ao Presidente do Tribunal de Contas, Vítor Manuel da Silva Caldeira",""
31 de janeiro de 2018,"",Audiências aos Parceiros Sociais,""
31 de janeiro de 2018,16:00,Confederação do Turismo Português (CTP),""
31 de janeiro de 2018,17:00,Confederação dos Agricultores de Portugal (CAP),""
